{
    "$schema": "https://json-schema.org/draft/2020-12/schema",
    "$id": "interrogations.schema.json",
    "title": "Interrogation",
    "description": "Допрос одного main_npc. По одному файлу на персонаж в каталоге interrogations/: interrogations/{character_id}.json. Текст вопросов и ответов — инлайн, без внешних ссылок. Уровни откровенности (candor_level) — это 5-ступенчатая шкала attitude (helpful/friendly/indifferent/unfriendly/hostile): стартовый уровень = attitude, затем меняется по ходу допроса.",
    "type": "object",
    "required": [
        "character_id",
        "name",
        "role",
        "status",
        "attitude",
        "base_questions",
        "scenarios"
    ],
    "properties": {
        "character_id": {
            "type": "string",
            "description": "ID персонажа (совпадает с именем файла и с ID в characters/). Напр. sailor."
        },
        "name": {
            "type": "string",
            "description": "Имя/название персонажа. Напр. Моряк."
        },
        "role": {
            "type": "string",
            "description": "Роль/должность. Напр. Моряк."
        },
        "status": {
            "type": "string",
            "description": "Статус допрашиваемого: main_npc (активный персонаж в игре) или ghost / speak_with_dead (недавно умершего — допрос через призрак/speak_with_dead)."
        },
        "attitude": {
            "type": "string",
            "enum": [
                "helpful",
                "friendly",
                "indifferent",
                "unfriendly",
                "hostile"
            ],
            "description": "Стартовое отношение к игроку (PF2e attitude). Определяет базовый DC проверок общения и стартовый уровень откровенности (candor_level) перед допросом. 5 ступеней: helpful (очень простая проверка), friendly (простая), indifferent (стандарт), unfriendly (сложная), hostile (очень сложная)."
        },
        "base_dc": {
            "type": [
                "string",
                "null"
            ],
            "description": "Базовый DC проверок общения (PF2e), выведенный из attitude. very_easy / easy / medium / hard / very_hard. Опционально — если не задано, берётся из attitude по умолчанию."
        },
        "default_reliability": {
            "type": [
                "string",
                "null"
            ],
            "description": "По умолчанию надёжность ответов персонажа (напр. mixed, reliable, unreliable)."
        },
        "candor_level": {
            "type": "string",
            "enum": [
                "no_trust",
                "cautious",
                "trust",
                "full_trust"
            ],
            "description": "Текущий уровень откровенности (Candor Level) во время допроса — шкала из 4 ступеней: no_trust → cautious → trust → full_trust. Отдельная ось от PF2e-attitude (которая задаёт базовый DC проверок общения). Стартовое значение = cautious. Меняется по ходу допроса: истинные улики (true_evidence), правильные вопросы и успешные проверки — повышают (no_trust→cautious→trust→full_trust); ложные улики (false_evidence), неправильные вопросы и провалы проверок — понижают (full_trust→trust→cautious→no_trust). Определяет, какой ключ ответа читается для вопроса."
        },
        "connection_tiers": {
            "type": "array",
            "description": "Уровни связи (PF2e Connection Tiers) между допрашиваемым и другими NPC. Долговременный фон, который задаёт «пол» доверия и влияет на реакцию допроса. Напр. {target, tier, type, note}. tier — из 6 уровней: acquainted/associated/devoted (положительные), avoided/despised/vindictive (отрицательные). При tier=despised/vindictive провалы быстрее ведут к нападению; при tier=devoted NPC охотнее раскрывает.",
            "items": {
                "$ref": "#/$defs/connection_tier"
            }
        },
        "base_questions": {
            "type": "object",
            "description": "Общие вопросы-ответы, одинаковые во всех сценариях. Подтягиваются автоматически в каждый сценарий. В scenarios[].questions пишется только отличие (override). Ключ — ID вопроса (A1, B5, Z3 и т.д.).",
            "patternProperties": {
                "^[A-Z][0-9]+$": {
                    "$ref": "#/$defs/question"
                }
            },
            "additionalProperties": false
        },
        "scenarios": {
            "type": "array",
            "description": "Массив сценариев. Каждый — только отличия от base_questions (override).",
            "items": {
                "$ref": "#/$defs/scenario"
            }
        }
    },
    "additionalProperties": true,
    "$defs": {
        "connection_tier": {
            "type": "object",
            "required": [
                "target",
                "tier"
            ],
            "description": "Уровень связи (Connection Tier) между допрашиваемым и конкретным NPC/организацией.",
            "properties": {
                "target": {
                    "type": "string",
                    "description": "ID персонажа/организации (напр. tavern_keeper, cult)."
                },
                "tier": {
                    "type": "string",
                    "enum": [
                        "acquainted",
                        "associated",
                        "devoted",
                        "avoided",
                        "despised",
                        "vindictive"
                    ],
                    "description": "Уровень связи (6 ступеней). Положительные (инвестированные): acquainted (базовый), associated (дружелюбен), devoted (искренне заинтересован). Отрицательные (враждебные): avoided (уклоняется), despised (активно избегает, мелкий саботаж), vindictive (цель — уничтожить/рушить планы)."
                },
                "type": {
                    "type": [
                        "string",
                        "null"
                    ],
                    "description": "Природа связи/причина (напр. hatred, money, religion, justice, love). Ссылка на relations.* в characters/."
                },
                "note": {
                    "type": [
                        "string",
                        "null"
                    ],
                    "description": "Необязательный комментарий (мотив, подварианты)."
                }
            },
            "additionalProperties": true
        },
        "question": {
            "type": "object",
            "required": [
                "q"
            ],
            "description": "Один вопрос с ответами по уровням откровенности (candor_level). В base_questions — общие ответы; в scenarios[].questions — override (можно задать только тот уровень, который отличается). Ключ ответа — ступень attitude: hostile / unfriendly / indifferent / friendly / (helpful — опционально, полное доверие).",
            "properties": {
                "q": {
                    "type": "string",
                    "description": "Текст вопроса."
                },
                "hostile": {
                    "type": "string",
                    "description": "Ответ на уровне откровенности hostile (был L1: неприязнь — откровенно лжёт или отказывается отвечать; критический провал проверки)."
                },
                "unfriendly": {
                    "type": "string",
                    "description": "Ответ на уровне откровенности unfriendly (был L2: обычное — очевидное/общеизвестное; провал проверки)."
                },
                "indifferent": {
                    "type": "string",
                    "description": "Ответ на уровне откровенности indifferent (был L3: малый секрет — secret.level small/medium; успех проверки)."
                },
                "friendly": {
                    "type": "string",
                    "description": "Ответ на уровне откровенности friendly (был L4: большой секрет — secret.level big; критический успех)."
                },
                "helpful": {
                    "type": [
                        "string",
                        "null"
                    ],
                    "description": "Ответ на уровне откровенности helpful (опционально: полное доверие — NPC сам подсказывает, выкладывает всё, включая то, что не просили). Читается, если candor_level достиг helpful (за пределами стандартной шкалы L1–L4)."
                },
                "delivery": {
                    "type": [
                        "string",
                        "null"
                    ],
                    "description": "Динамическая подача для этого вопроса (переопределение/уточнение speech_profile.level_styles для данного вопроса). Не заменяет ответы, а описывает, как их произносить именно здесь. Напр. 'в friendly — шёпотом, впервые смотрит в глаза'."
                },
                "speech_tags": {
                    "type": "array",
                    "description": "Метки речи для этого вопроса (уточняют подачу/жесты/лексик в данном вопросе). Напр. ['крутит перстень', 'поправляет воротник', 'шёпотом'].",
                    "items": {
                        "type": "string"
                    }
                }
            },
            "additionalProperties": true
        },
        "scenario": {
            "type": "object",
            "required": [
                "id",
                "victim",
                "murder",
                "true_evidence",
                "false_evidence",
                "questions"
            ],
            "description": "Сценарий (d6-маппинг). Только отличия от base_questions. Если questions пустой — берётся всё из base_questions; если в questions есть ключ (напр. A6) — он замещает A6 из base_questions в этом сценарии.",
            "properties": {
                "id": {
                    "type": "string",
                    "pattern": "^S0?\\d\\d$",
                    "description": "ID сценария: S + 2 цифры d6. Первая цифра — номер жертвы (d6), вторая — номер убийца (d6). Ведущий 0 (S0X) — несчастный случай (murder: null, cause: accident). d6-маппинг: 1=Трактирщик, 2=Моряк, 3=Официантка, 4=Врач, 5=Детектив, 6=Художник."
                },
                "victim": {
                    "type": "string",
                    "description": "ID жертвы (character_id)."
                },
                "murder": {
                    "type": [
                        "string",
                        "null"
                    ],
                    "description": "ID убийцы (character_id). null — несчастный случай (S0X)."
                },
                "cause": {
                    "type": "string",
                    "description": "Причина смерти. Обязательно только для S0X (несчастный случай, напр. accident); иначе может отсутствовать."
                },
                "note": {
                    "type": [
                        "string",
                        "null"
                    ],
                    "description": "Необязательный комментарий к сценарию (мотив, подварианты)."
                },
                "true_evidence": {
                    "type": "array",
                    "description": "Улики, которые повышают уровень откровенности при демонстрации (hostile→unfriendly→indifferent→friendly→helpful). ID из evidence.json.",
                    "items": {
                        "type": "string"
                    }
                },
                "false_evidence": {
                    "type": "array",
                    "description": "Улики, которые понижают уровень откровенности при демонстрации (helpful→friendly→indifferent→unfriendly→hostile). ID из evidence.json.",
                    "items": {
                        "type": "string"
                    }
                },
                "questions": {
                    "type": "object",
                    "description": "Только вопросы, которые ОТЛИЧАЮТСЯ от base_questions (override). Ключ — ID вопроса; значение замещает соответствующий вопрос из base_questions в этом сценарии.",
                    "patternProperties": {
                        "^[A-Z][0-9]+$": {
                            "$ref": "#/$defs/question"
                        }
                    },
                    "additionalProperties": false
                }
            },
            "additionalProperties": true
        }
    }
}
