{
    "character_id": "duxotar",
    "name": "Илтус Мартис",
    "role": "Дуксотар",
    "status": "main_npc",
    "attitude": "unfriendly",
    "base_dc": "hard",
    "default_reliability": "mixed",
    "candor_level": "cautious",
    "base_questions": {
        "A1": {
            "q": "«Что за серия убийств? Сколько тел?»",
            "hostile": "«Не твоё дело. Уйди».",
            "unfriendly": "«Трупы. Много. Дальше не спрашивай».",
            "indifferent": "«Три… нет, четыре. Я сбился. Детектив считает. Сария платит — он считает».",
            "friendly": "«Три точно. Может, четыре. Детектив ведёт счёт. Я — подписываю».",
            "helpful": "«Три подтверждённых. Четвёртый — на подходе. Джакомо наняла дуротас Сария Рокцин, потому что сам я не справляюсь. Пей со мной, и я расскажу, что знаю»."
        },
        "A2": {
            "q": "«Кто жертвы?»",
            "hostile": "«Мясо. В морге».",
            "unfriendly": "«Культисты. Воры. Горожане. Всех не упомнишь».",
            "indifferent": "«Культисты, воры, горожане. Я не смотрю на трупы. Я подписываю бумаги».",
            "friendly": "«Культисты. Воры. Один горожанин. Почерк один — нарезка и птицы на стенах».",
            "helpful": "«Культисты Дагона, Совет Воров, один горожанин. Почерк: ровные срезы, птица на стене. Это не ритуал — это демонстрация»."
        },
        "A3": {
            "q": "«Есть ли почерк?»",
            "hostile": "«Почерк? Иди в морг».",
            "unfriendly": "«Нарезка. Птицы на стенах. Я не смотрю на трупы».",
            "indifferent": "«Нарезка. Птицы. Я не смотрю. Я подписываю».",
            "friendly": "«Нарезка и птицы на стенах. Один и тот же убийца. Джакомо говорит — это „спектакль“».",
            "helpful": "«Ровные срезы, птица на стене, жертвы — культисты и воры. Убийца не спешит. Он позирует. Джакомо говорит — это одиночка с манией величия»."
        },
        "A4": {
            "q": "«Кто расследует?»",
            "hostile": "«Не твоё дело».",
            "unfriendly": "«Детектив. Джакомо. Наняла Сария, дуротас».",
            "indifferent": "«Джакомо. Детектив. Наняла его Сария, дуротас. Он пьёт, но работает».",
            "friendly": "«Джакомо Раньери. Из столицы. Наняла его Сария. Он умнее меня. Это не сложно».",
            "helpful": "«Джакомо Раньери. Я знал его… давно. Он пьёт, но видит то, что я не вижу. Наняла его дуротас Сария Рокцин — из своего кармана. Я лишь подписываю. Дядя на «расследования» не даёт»."
        },
        "A5": {
            "q": "«Почему ты не расследуешь сам?»",
            "hostile": "«Я — Дуксотар. Не твоё дело».",
            "unfriendly": "«Я командую. А не бегаю по моргам».",
            "indifferent": "«Я — Дуксотар. Я командую. А не бегаю по моргам».",
            "friendly": "«Я командую. Формально. Реально — дуротасы. А я — подписываю. И пью. Джакомо — бегает».",
            "helpful": "«Потому что я пьян, слаб и некомпетентен. Все это знают. Я — племянник лорд-мэра, а не сыщик. Расследование ведёт дуротас Сария Рокцин: она наняла Джакомо. Он — её глаза и ноги. Я — только подпись»."
        },
        "A6": {
            "q": "«Где отчёты о вскрытии?»",
            "hostile": "«У докторишки. Отстань».",
            "unfriendly": "«У Элио. В морге. Он тянет».",
            "indifferent": "«У докторишки. Элио Вентури. Из Морга. Всё тянет».",
            "friendly": "«У Элио Вентури, из Морга. Он говорит — не закончил. Я жду. Джакомо тоже ждёт».",
            "helpful": "«У Элио. Он тянет уже неделю. Я думаю — он что-то скрывает. Но я не проверял. Может, ты проверишь?»"
        },
        "A7": {
            "q": "«Почему ты не арестовал подозреваемых?»",
            "hostile": "«Каких? Уйди».",
            "unfriendly": "«Я не знаю, кто они. Детектив говорит — не время».",
            "indifferent": "«Каких? Я даже не знаю, кто они. Детектив говорит — не время. Я верю. Он умнее».",
            "friendly": "«Я не знаю, кто они. Джакомо говорит — рано. Если арестовать сейчас — таверна превратится в бойню. Я верю».",
            "helpful": "«Потому что я боюсь. Если арестовать не того — Совет придёт. Если арестовать того — культ придёт. Если начать бойню в запертой таверне — все умрут. Джакомо прав: ждём»."
        },
        "A8": {
            "q": "«Кто платит Детективу?»",
            "hostile": "«Не твоё дело».",
            "unfriendly": "«Достаточно».",
            "indifferent": "«Это не я. Платит Сария, дуротас. Из своего. Не твоё дело».",
            "friendly": "«Платит Сария — достаточно, чтобы он не ушёл. Из своего кармана. Дядя на „расследования“ не даёт, у города бюджета нет».",
            "helpful": "«Платит Сария. Из своего. Дядя считает, что это „городская грязь“. Я лишь подписываю. Если не она — никто»."
        },
        "A9": {
            "q": "«Ты сам видел места преступлений?»",
            "hostile": "«Нет. И не буду».",
            "unfriendly": "«Я? Нет. Доттари смотрят».",
            "indifferent": "«Я? Нет. Я подписываю. Доттари смотрят. Детектив смотрит. Я — нет».",
            "friendly": "«Нет. Я не выхожу ночью. Доттари смотрят днём. Джакомо смотрит. Я — подписываю».",
            "helpful": "«Нет. Я боюсь. После заката — твари. Я не выхожу. Это стыдно. Но это правда»."
        },
        "A10": {
            "q": "«Кто здесь главный?»",
            "hostile": "«Я. Уйди».",
            "unfriendly": "«Я. Формально. Дальше не спрашивай».",
            "indifferent": "«Я. Дуксотар. То есть — формально. Реально — Совет. И дуротасы. И Адские рыцари. И лорд-мэр. Все, кроме меня».",
            "friendly": "«Формально — я. Реально — Совет Воров, дуротасы, Адские рыцари. И дядя. Я — подписываю».",
            "helpful": "«Никто. И все. Я — видимость. Совет — тень. Дуротасы — четыре банды. Адские рыцари — отдельно. Дядя — номинально. В Весткроуне никто не главный. Это и есть проблема»."
        },
        "B1": {
            "q": "«Почему город в упадке?»",
            "hostile": "«Не твоё дело».",
            "unfriendly": "«Дом Трун. Дальше».",
            "indifferent": "«Дом Трун перенёс столицу. Богатство ушло. Осталось… это. Пей, не спрашивай».",
            "friendly": "«Дом Трун перенёс столицу в Эгориан. Богатство ушло. Осталось то, что видишь».",
            "helpful": "«Город потерял бога, потом статус, потом деньги. Теперь — тени. В прямом смысле. И я — во главе этого. Пьяный. Смешно, да?»"
        },
        "B2": {
            "q": "«Почему комендантский час?»",
            "hostile": "«Приказ. Уйди».",
            "unfriendly": "«Теневые твари. После заката. Всё».",
            "indifferent": "«Теневые твари. После заката. Приказ лорд-мэра. Восемнадцать ноль-ноль».",
            "friendly": "«Теневые твари. После заката. Приказ дяди. Я не выхожу. Доттари не выходят. Все сидят».",
            "helpful": "«Теневые твари. После заката. Приказ дяди — но на самом деле это приказ Совета. Я подписал. Я всегда подписываю. Я не знаю, что это за твари. И не хочу знать»."
        },
        "B3": {
            "q": "«Кто такие доттари?»",
            "hostile": "«Стража. Уйди».",
            "unfriendly": "«Стража. Моя. Формально».",
            "indifferent": "«Стража. Моя стража. Ну… формально. Четыре банды с одним названием. Дуротасы делят город. Я — подписываю».",
            "friendly": "«Городская стража. Моя. Формально. Реально — четыре банды. Дуротасы делят город. Я — подписываю бумаги. И пью».",
            "helpful": "«Четыре банды с одним названием. Common dottari, Condottari, Rundottari, Regidottari. Дуротасы делят город на зоны. Я — видимость командира. Реально — никто. Дядя поставил меня сюда. Я не справляюсь»."
        },
        "B4": {
            "q": "«Кто такие дуротасы?»",
            "hostile": "«Капитаны. Уйди».",
            "unfriendly": "«Капитаны. Четыре. Дальше не спрашивай».",
            "indifferent": "«Капитаны. Четыре. Они делят город на зоны. Я не лезу. Они не лезут. Так проще».",
            "friendly": "«Четыре капитана. Каждый — своя зона. Я не лезу. Они не лезут. Так проще. Для всех».",
            "helpful": "«Четыре капитана. Они — реальная власть в доттари. Я — подписываю то, что они решают. Если ты хочешь что-то сделать в городе — иди к ним, не ко мне»."
        },
        "B5": {
            "q": "«Что ты знаешь о Совете Воров?»",
            "hostile": "«Легенда. Уйди».",
            "unfriendly": "«Сказка. Дальше не спрашивай».",
            "indifferent": "«Легенда. Сказка. Но… если что-то пропадает — они. Если кто-то платит — они. Я не знаю. И не хочу».",
            "friendly": "«Легенда. Сказка. Но если что-то пропадает — они. Если кто-то платит — они. Я не знаю. И не хочу. И тебе не советую».",
            "helpful": "«Они — реальная власть. Вассиндио Дровендж — патриарх. Я — видимость. Я не знаю деталей. И не хочу. Если ты полезешь — я тебя не знаю. Понял?»"
        },
        "B6": {
            "q": "«Ты работаешь на Совет?»",
            "hostile": "«Нет! Уйди!»",
            "unfriendly": "«Нет. Я — Дуксотар».",
            "indifferent": "«Нет! Я — Дуксотар! Я служу городу!» *(пьёт)* «Просто… иногда я не мешаю».",
            "friendly": "«Нет. Я — Дуксотар. Но… иногда я не мешаю. Это не работа. Это… выживание».",
            "helpful": "«Формально — нет. Реально — я не мешаю. Если они что-то делают — я не вижу. Если они платят — я не считаю. Это не работа. Это… то, что осталось от меня»."
        },
        "B7": {
            "q": "«Кто такой лорд-мэр?»",
            "hostile": "«Дядя. Уйди».",
            "unfriendly": "«Абериан Арванкси. Мой дядя».",
            "indifferent": "«Абериан Арванкси. Мой дядя. Он — лорд-мэр. Я — Дуксотар. По родству. Не по заслугам. Все это знают».",
            "friendly": "«Абериан Арванкси. Мой дядя. Он — лорд-мэр. Я — по родству. Не по заслугам. Он это знает. Я это знаю. Все это знают».",